{
  "$schema": "https://json-schema.org/draft/2020-12/schema",
  "$id": "https://raw.githubusercontent.com/oh-my-dsh/dsh-plugin-registry/main/registry/schema/plugin-index.schema.json",
  "title": "DSH plugin registry index",
  "description": "The deterministic public index generated from reviewed dsh-plugin-registry/v2 entries.",
  "type": "object",
  "additionalProperties": false,
  "required": ["schemaVersion", "contract", "source", "plugins"],
  "properties": {
    "$schema": {
      "const": "https://raw.githubusercontent.com/oh-my-dsh/dsh-plugin-registry/main/registry/schema/plugin-index.schema.json"
    },
    "schemaVersion": { "const": 2 },
    "contract": { "const": "dsh-plugin-registry/v2" },
    "source": { "const": "registry/entries" },
    "plugins": {
      "type": "array",
      "items": { "$ref": "#/$defs/indexEntry" }
    }
  },
  "$defs": {
    "indexEntry": {
      "type": "object",
      "additionalProperties": false,
      "required": ["schemaVersion", "plugin", "source", "compatibility", "claims", "manifestPath"],
      "properties": {
        "$schema": { "type": "string", "minLength": 1 },
        "schemaVersion": { "const": 2 },
        "plugin": {
          "type": "object",
          "additionalProperties": false,
          "required": ["id", "repository", "package", "status"],
          "properties": {
            "id": { "$ref": "#/$defs/coordinate" },
            "displayName": { "type": "string", "minLength": 1, "maxLength": 128 },
            "repository": {
              "type": "string",
              "pattern": "^https://github\\.com/[A-Za-z0-9](?:[A-Za-z0-9-]{0,37}[A-Za-z0-9])?/(?!\\.{1,2}/?$)[A-Za-z0-9._-]{1,100}/?$",
              "maxLength": 512
            },
            "package": { "$ref": "#/$defs/packageName" },
            "release": { "$ref": "#/$defs/semver" },
            "status": { "enum": ["active", "deprecated", "archived"] }
          }
        },
        "source": {
          "type": "object",
          "additionalProperties": false,
          "required": ["commit", "namingManifest"],
          "properties": {
            "commit": { "type": "string", "pattern": "^[0-9a-f]{40}$" },
            "namingManifest": {
              "type": "string",
              "pattern": "^(?!/)(?!.*(?:^|/)\\.{1,2}(?:/|$))(?!.*//)[^\\u0000-\\u001f\\u007f\\\\?#]+\\.json$",
              "maxLength": 512
            }
          }
        },
        "compatibility": {
          "type": "object",
          "additionalProperties": false,
          "required": ["harness"],
          "properties": {
            "harness": {
              "type": "object",
              "additionalProperties": false,
              "required": ["min"],
              "properties": {
                "min": { "$ref": "#/$defs/semver" },
                "maxExclusive": { "$ref": "#/$defs/semver" }
              }
            }
          }
        },
        "claims": { "$ref": "#/$defs/claims" },
        "manifestPath": {
          "type": "string",
          "pattern": "^(?!/)(?!.*(?:^|/)\\.{1,2}(?:/|$))(?!.*//)[^\\u0000-\\u001f\\u007f\\\\?#]+\\.json$",
          "maxLength": 512
        }
      }
    },
    "claims": {
      "type": "object",
      "additionalProperties": false,
      "required": [
        "pluginNames",
        "loaderIds",
        "services",
        "tools",
        "commands",
        "skills",
        "skillProviders",
        "events",
        "settingsNamespaces",
        "routes"
      ],
      "properties": {
        "pluginNames": { "$ref": "#/$defs/names" },
        "loaderIds": {
          "type": "array",
          "minItems": 1,
          "uniqueItems": true,
          "items": {
            "type": "object",
            "additionalProperties": false,
            "required": ["name", "composition", "layer", "overrideIntent"],
            "properties": {
              "name": { "$ref": "#/$defs/name" },
              "composition": { "$ref": "#/$defs/scope" },
              "layer": { "type": "integer", "minimum": 0, "maximum": 1024 },
              "overrideIntent": { "enum": ["none", "replace"] }
            }
          }
        },
        "services": { "$ref": "#/$defs/scopedNames" },
        "tools": { "$ref": "#/$defs/scopedNames" },
        "commands": { "$ref": "#/$defs/scopedNames" },
        "skills": {
          "type": "array",
          "uniqueItems": true,
          "items": {
            "type": "object",
            "additionalProperties": false,
            "required": ["name", "scope", "provider", "rank"],
            "properties": {
              "name": { "$ref": "#/$defs/name" },
              "scope": { "$ref": "#/$defs/scope" },
              "provider": { "$ref": "#/$defs/name" },
              "rank": { "type": "integer", "minimum": -1000000, "maximum": 1000000 }
            }
          }
        },
        "skillProviders": { "$ref": "#/$defs/scopedNames" },
        "events": {
          "type": "array",
          "uniqueItems": true,
          "items": {
            "type": "object",
            "additionalProperties": false,
            "required": ["name", "scope", "role", "schema"],
            "properties": {
              "name": { "$ref": "#/$defs/name" },
              "scope": { "$ref": "#/$defs/scope" },
              "role": { "enum": ["publisher", "consumer", "both"] },
              "schema": {
                "oneOf": [
                  { "type": "string", "minLength": 1, "maxLength": 512 },
                  { "type": "null" }
                ]
              }
            }
          }
        },
        "settingsNamespaces": { "$ref": "#/$defs/scopedNames" },
        "routes": {
          "type": "array",
          "uniqueItems": true,
          "items": {
            "type": "object",
            "additionalProperties": false,
            "required": ["kind", "path", "scope"],
            "properties": {
              "kind": { "enum": ["exact", "prefix", "upgrade"] },
              "path": {
                "type": "string",
                "pattern": "^/[^?#\\s]*[^/?#\\s]$",
                "maxLength": 256
              },
              "scope": { "$ref": "#/$defs/scope" }
            }
          }
        }
      }
    },
    "coordinate": {
      "type": "string",
      "pattern": "^[a-z][a-z0-9]*(?:-[a-z0-9]+)*/[a-z0-9]+(?:-[a-z0-9]+)*$",
      "maxLength": 127
    },
    "semver": {
      "type": "string",
      "pattern": "^(0|[1-9][0-9]*)\\.(0|[1-9][0-9]*)\\.(0|[1-9][0-9]*)(?:-(?:0|[1-9][0-9]*|[0-9A-Za-z-]*[A-Za-z-][0-9A-Za-z-]*)(?:\\.(?:0|[1-9][0-9]*|[0-9A-Za-z-]*[A-Za-z-][0-9A-Za-z-]*))*)?(?:\\+[0-9A-Za-z-]+(?:\\.[0-9A-Za-z-]+)*)?$",
      "maxLength": 128
    },
    "packageName": {
      "type": "string",
      "pattern": "^(?:@[a-z0-9][a-z0-9._-]*/)?[a-z0-9][a-z0-9._-]*$",
      "maxLength": 214
    },
    "name": {
      "type": "string",
      "minLength": 1,
      "maxLength": 192,
      "pattern": "^[^\\s\\u0000-\\u001f\\u007f]+$"
    },
    "names": {
      "type": "array",
      "minItems": 1,
      "uniqueItems": true,
      "items": { "$ref": "#/$defs/name" }
    },
    "scope": {
      "type": "string",
      "pattern": "^(?:root|agent|unknown|isolated:[a-z0-9]+(?:-[a-z0-9]+)*)$",
      "maxLength": 128
    },
    "scopedNames": {
      "type": "array",
      "uniqueItems": true,
      "items": {
        "type": "object",
        "additionalProperties": false,
        "required": ["name", "scope"],
        "properties": {
          "name": { "$ref": "#/$defs/name" },
          "scope": { "$ref": "#/$defs/scope" }
        }
      }
    }
  }
}
